upload=true&script=true&cardinfo=
!!################################
!!ALSA Information Script v 0.4.59
!!################################

!!Script ran on: Tue Dec 21 15:02:51 UTC 2010


!!Linux Distribution
!!------------------

Fedora release 14 (Laughlin) Fedora release 14 (Laughlin) Fedora release 14 (Laughlin) Fedora release 14 (Laughlin)


!!DMI Information
!!---------------

Manufacturer:      Eurotech, Inc.
Product Name:      Catalyst


!!Kernel Information
!!------------------

Kernel release:    2.6.35.9-64.fc14.i686
Operating System:  GNU/Linux
Architecture:      i686
Processor:         i686
SMP Enabled:       Yes


!!ALSA Version
!!------------

Driver version:     1.0.23
Library version:    1.0.23
Utilities version:  1.0.23


!!Loaded ALSA modules
!!-------------------

snd_hda_intel


!!Sound Servers on this system
!!----------------------------

Jack:
      Installed - Yes (/usr/bin/jackd)
      Running - No


!!Soundcards recognised by ALSA
!!-----------------------------

 0 [MID            ]: HDA-Intel - HDA Intel MID
                      HDA Intel MID at 0x942c0000 irq 46


!!PCI Soundcards installed in the system
!!--------------------------------------

00:1b.0 Audio device: Intel Corporation System Controller Hub (SCH Poulsbo) HD Audio Controller (rev 07)


!!Advanced information - PCI Vendor/Device/Susbsystem ID's
!!--------------------------------------------------------

00:1b.0 0403: 8086:811b (rev 07)
	Subsystem: 8086:8119


!!Modprobe options (Sound related)
!!--------------------------------

snd-hda-intel: probe_mask=0x102 position_fix=0


!!Loaded sound module options
!!--------------------------

!!Module: snd_hda_intel
	bdl_pos_adj : 32,-1,-1,-1,-1,-1,-1,-1,-1,-1,-1,-1,-1,-1,-1,-1,-1,-1,-1,-1,-1,-1,-1,-1,-1,-1,-1,-1,-1,-1,-1,-1
	beep_mode : 0,0,0,0,0,0,0,0,0,0,0,0,0,0,0,0,0,0,0,0,0,0,0,0,0,0,0,0,0,0,0,0
	enable : Y,Y,Y,Y,Y,Y,Y,Y,Y,Y,Y,Y,Y,Y,Y,Y,Y,Y,Y,Y,Y,Y,Y,Y,Y,Y,Y,Y,Y,Y,Y,Y
	enable_msi : -1
	id : (null),(null),(null),(null),(null),(null),(null),(null),(null),(null),(null),(null),(null),(null),(null),(null),(null),(null),(null),(null),(null),(null),(null),(null),(null),(null),(null),(null),(null),(null),(null),(null)
	index : -1,-1,-1,-1,-1,-1,-1,-1,-1,-1,-1,-1,-1,-1,-1,-1,-1,-1,-1,-1,-1,-1,-1,-1,-1,-1,-1,-1,-1,-1,-1,-1
	model : (null),(null),(null),(null),(null),(null),(null),(null),(null),(null),(null),(null),(null),(null),(null),(null),(null),(null),(null),(null),(null),(null),(null),(null),(null),(null),(null),(null),(null),(null),(null),(null)
	patch : (null),(null),(null),(null),(null),(null),(null),(null),(null),(null),(null),(null),(null),(null),(null),(null),(null),(null),(null),(null),(null),(null),(null),(null),(null),(null),(null),(null),(null),(null),(null),(null)
	position_fix : 0,0,0,0,0,0,0,0,0,0,0,0,0,0,0,0,0,0,0,0,0,0,0,0,0,0,0,0,0,0,0,0
	power_save : 0
	power_save_controller : Y
	probe_mask : 258,-1,-1,-1,-1,-1,-1,-1,-1,-1,-1,-1,-1,-1,-1,-1,-1,-1,-1,-1,-1,-1,-1,-1,-1,-1,-1,-1,-1,-1,-1,-1
	probe_only : 0,0,0,0,0,0,0,0,0,0,0,0,0,0,0,0,0,0,0,0,0,0,0,0,0,0,0,0,0,0,0,0
	single_cmd : N


!!HDA-Intel Codec information
!!---------------------------
--startcollapse--

Codec: Analog Devices AD1989A
Address: 1
Function Id: 0x1
Vendor Id: 0x11d4989a
Subsystem Id: 0xbfd80000
Revision Id: 0x100300
No Modem Function Group found
Default PCM:
    rates [0x7ff]: 8000 11025 16000 22050 32000 44100 48000 88200 96000 176400 192000
    bits [0xe]: 16 20 24
    formats [0x1]: PCM
Default Amp-In caps: ofs=0x00, nsteps=0x00, stepsize=0x00, mute=1
Default Amp-Out caps: ofs=0x27, nsteps=0x27, stepsize=0x05, mute=0
GPIO: io=3, o=0, i=0, unsolicited=1, wake=0
  IO[0]: enable=0, dir=0, wake=0, sticky=0, data=0, unsol=0
  IO[1]: enable=0, dir=0, wake=0, sticky=0, data=0, unsol=0
  IO[2]: enable=0, dir=0, wake=0, sticky=0, data=0, unsol=0
Node 0x02 [Audio Output] wcaps 0x30211: Stereo Digital
  Control: name="IEC958 Playback Con Mask", index=0, device=0
  Control: name="IEC958 Playback Pro Mask", index=0, device=0
  Control: name="IEC958 Playback Default", index=0, device=0
  Control: name="IEC958 Playback Switch", index=0, device=0
  Control: name="IEC958 Default PCM Playback Switch", index=0, device=0
  Device: name="AD198x Digital", type="SPDIF", device=1
  Converter: stream=0, channel=0
  Digital:
  Digital category: 0x0
  PCM:
    rates [0x7e0]: 44100 48000 88200 96000 176400 192000
    bits [0xe]: 16 20 24
    formats [0x5]: PCM AC3
  Delay: 3 samples
Node 0x03 [Audio Output] wcaps 0x405: Stereo Amp-Out
  Amp-Out caps: ofs=0x27, nsteps=0x27, stepsize=0x05, mute=0
  Amp-Out vals:  [0x19 0x19]
  Converter: stream=3, channel=0
  Power states:  D0 D3
  Power: setting=D0, actual=D0
Node 0x04 [Audio Output] wcaps 0x405: Stereo Amp-Out
  Control: name="Front Playback Volume", index=0, device=0
    ControlAmp: chs=3, dir=Out, idx=0, ofs=0
  Device: name="AD198x Analog", type="Audio", device=0
  Amp-Out caps: ofs=0x27, nsteps=0x27, stepsize=0x05, mute=0
  Amp-Out vals:  [0x27 0x27]
  Converter: stream=0, channel=0
  Power states:  D0 D3
  Power: setting=D0, actual=D0
Node 0x05 [Audio Output] wcaps 0x405: Stereo Amp-Out
  Control: name="Center Playback Volume", index=0, device=0
    ControlAmp: chs=1, dir=Out, idx=0, ofs=0
  Control: name="LFE Playback Volume", index=0, device=0
    ControlAmp: chs=2, dir=Out, idx=0, ofs=0
  Amp-Out caps: ofs=0x27, nsteps=0x27, stepsize=0x05, mute=0
  Amp-Out vals:  [0x00 0x00]
  Converter: stream=0, channel=0
  Power states:  D0 D3
  Power: setting=D0, actual=D0
Node 0x06 [Audio Output] wcaps 0x405: Stereo Amp-Out
  Control: name="Surround Playback Volume", index=0, device=0
    ControlAmp: chs=3, dir=Out, idx=0, ofs=0
  Amp-Out caps: ofs=0x27, nsteps=0x27, stepsize=0x05, mute=0
  Amp-Out vals:  [0x00 0x00]
  Converter: stream=0, channel=0
  Power states:  D0 D3
  Power: setting=D0, actual=D0
Node 0x07 [Audio Input] wcaps 0x130391: Stereo Digital
  Control: name="IEC958 Capture Switch", index=0, device=0
  Control: name="IEC958 Capture Default", index=0, device=0
  Device: name="AD198x Digital", type="SPDIF", device=1
  Converter: stream=0, channel=0
  SDI-Select: 0
  Digital:
  Digital category: 0x0
  PCM:
    rates [0x7e0]: 44100 48000 88200 96000 176400 192000
    bits [0xe]: 16 20 24
    formats [0x5]: PCM AC3
  Unsolicited: tag=00, enabled=0
  Delay: 3 samples
  Connection: 1
     0x1c
Node 0x08 [Audio Input] wcaps 0x100501: Stereo
  Device: name="AD198x Analog", type="Audio", device=0
  Converter: stream=0, channel=0
  SDI-Select: 0
  Power states:  D0 D3
  Power: setting=D0, actual=D0
  Connection: 1
     0x0c
Node 0x09 [Audio Input] wcaps 0x100501: Stereo
  Converter: stream=0, channel=0
  SDI-Select: 0
  Power states:  D0 D3
  Power: setting=D0, actual=D0
  Connection: 1
     0x0d
Node 0x0a [Audio Output] wcaps 0x405: Stereo Amp-Out
  Amp-Out caps: ofs=0x27, nsteps=0x27, stepsize=0x05, mute=0
  Amp-Out vals:  [0x00 0x00]
  Converter: stream=0, channel=0
  Power states:  D0 D3
  Power: setting=D0, actual=D0
Node 0x0b [Audio Output] wcaps 0x30211: Stereo Digital
  Converter: stream=0, channel=0
  Digital:
  Digital category: 0x0
  PCM:
    rates [0x7e0]: 44100 48000 88200 96000 176400 192000
    bits [0xe]: 16 20 24
    formats [0x5]: PCM AC3
  Delay: 3 samples
Node 0x0c [Audio Selector] wcaps 0x30010d: Stereo Amp-Out
  Control: name="Capture Volume", index=0, device=0
    ControlAmp: chs=3, dir=Out, idx=0, ofs=0
  Control: name="Capture Switch", index=0, device=0
    ControlAmp: chs=3, dir=Out, idx=0, ofs=0
  Control: name="Input Source", index=0, device=0
  Amp-Out caps: ofs=0x27, nsteps=0x36, stepsize=0x05, mute=1
  Amp-Out vals:  [0x2f 0x2f]
  Connection: 11
     0x38 0x39* 0x3a 0x3b 0x3c 0x18 0x24 0x25 0x3d 0x20 0x1f
Node 0x0d [Audio Selector] wcaps 0x30010d: Stereo Amp-Out
  Control: name="Capture Volume", index=1, device=0
    ControlAmp: chs=3, dir=Out, idx=0, ofs=0
  Control: name="Capture Switch", index=1, device=0
    ControlAmp: chs=3, dir=Out, idx=0, ofs=0
  Control: name="Input Source", index=1, device=0
  Amp-Out caps: ofs=0x27, nsteps=0x36, stepsize=0x05, mute=1
  Amp-Out vals:  [0xa7 0xa7]
  Connection: 10
     0x38 0x39* 0x3a 0x3b 0x3c 0x18 0x24 0x25 0x3d 0x20
Node 0x0e [Audio Selector] wcaps 0x30010d: Stereo Amp-Out
  Control: name="Capture Volume", index=2, device=0
    ControlAmp: chs=3, dir=Out, idx=0, ofs=0
  Control: name="Capture Switch", index=2, device=0
    ControlAmp: chs=3, dir=Out, idx=0, ofs=0
  Control: name="Input Source", index=2, device=0
  Amp-Out caps: ofs=0x27, nsteps=0x36, stepsize=0x05, mute=1
  Amp-Out vals:  [0xa7 0xa7]
  Connection: 10
     0x38 0x39* 0x3a 0x3b 0x3c 0x18 0x24 0x25 0x3d 0x20
Node 0x0f [Audio Input] wcaps 0x100501: Stereo
  Converter: stream=0, channel=0
  SDI-Select: 0
  Power states:  D0 D3
  Power: setting=D0, actual=D0
  Connection: 1
     0x0e
Node 0x10 [Beep Generator Widget] wcaps 0x70000c: Mono Amp-Out
  Control: name="Beep Playback Volume", index=0, device=0
    ControlAmp: chs=1, dir=Out, idx=0, ofs=0
  Control: name="Beep Playback Switch", index=0, device=0
    ControlAmp: chs=1, dir=Out, idx=0, ofs=0
  Amp-Out caps: ofs=0x0f, nsteps=0x0f, stepsize=0x0b, mute=1
  Amp-Out vals:  [0x00]
Node 0x11 [Pin Complex] wcaps 0x40018d: Stereo Amp-Out
  Amp-Out caps: ofs=0x00, nsteps=0x00, stepsize=0x00, mute=1
  Amp-Out vals:  [0x00 0x00]
  Pincap 0x0000373f: IN OUT HP Detect Trigger ImpSense
    Vref caps: HIZ 50 GRD 80 100
  Pin Default 0x02214030: [Jack] HP Out at Ext Front
    Conn = 1/8, Color = Green
    DefAssociation = 0x3, Sequence = 0x0
  Pin-ctls: 0xc0: OUT HP VREF_HIZ
  Unsolicited: tag=00, enabled=0
  Connection: 1
     0x22
Node 0x12 [Pin Complex] wcaps 0x40018d: Stereo Amp-Out
  Amp-Out caps: ofs=0x00, nsteps=0x00, stepsize=0x00, mute=1
  Amp-Out vals:  [0x00 0x00]
  Pincap 0x0000373f: IN OUT HP Detect Trigger ImpSense
    Vref caps: HIZ 50 GRD 80 100
  Pin Default 0x01014010: [Jack] Line Out at Ext Rear
    Conn = 1/8, Color = Green
    DefAssociation = 0x1, Sequence = 0x0
  Pin-ctls: 0x40: OUT VREF_HIZ
  Unsolicited: tag=00, enabled=0
  Connection: 1
     0x29
Node 0x13 [Pin Complex] wcaps 0x40010c: Mono Amp-Out
  Amp-Out caps: ofs=0x1f, nsteps=0x1f, stepsize=0x05, mute=1
  Amp-Out vals:  [0x00]
  Pincap 0x00000010: OUT
  Pin Default 0x991301f0: [Fixed] Speaker at Int ATAPI
    Conn = ATAPI, Color = Unknown
    DefAssociation = 0xf, Sequence = 0x0
    Misc = NO_PRESENCE
  Pin-ctls: 0x40: OUT
  Connection: 1
     0x2d
Node 0x14 [Pin Complex] wcaps 0x40018d: Stereo Amp-Out
  Amp-Out caps: ofs=0x00, nsteps=0x00, stepsize=0x00, mute=1
  Amp-Out vals:  [0x80 0x80]
  Pincap 0x0000373f: IN OUT HP Detect Trigger ImpSense
    Vref caps: HIZ 50 GRD 80 100
  Pin Default 0x02a19040: [Jack] Mic at Ext Front
    Conn = 1/8, Color = Pink
    DefAssociation = 0x4, Sequence = 0x0
  Pin-ctls: 0x24: IN VREF_80
  Unsolicited: tag=00, enabled=0
  Connection: 1
     0x2b
Node 0x15 [Pin Complex] wcaps 0x40018d: Stereo Amp-Out
  Amp-Out caps: ofs=0x00, nsteps=0x00, stepsize=0x00, mute=1
  Amp-Out vals:  [0x80 0x80]
  Pincap 0x00003737: IN OUT Detect Trigger ImpSense
    Vref caps: HIZ 50 GRD 80 100
  Pin Default 0x01813021: [Jack] Line In at Ext Rear
    Conn = 1/8, Color = Blue
    DefAssociation = 0x2, Sequence = 0x1
  Pin-ctls: 0x20: IN VREF_HIZ
  Unsolicited: tag=00, enabled=0
  Connection: 1
     0x2c
Node 0x16 [Pin Complex] wcaps 0x40018d: Stereo Amp-Out
  Amp-Out caps: ofs=0x00, nsteps=0x00, stepsize=0x00, mute=1
  Amp-Out vals:  [0x00 0x00]
  Pincap 0x00000037: IN OUT Detect Trigger ImpSense
  Pin Default 0x01011012: [Jack] Line Out at Ext Rear
    Conn = 1/8, Color = Black
    DefAssociation = 0x1, Sequence = 0x2
  Pin-ctls: 0x40: OUT
  Unsolicited: tag=00, enabled=0
  Connection: 1
     0x2a
Node 0x17 [Pin Complex] wcaps 0x40098d: Stereo Amp-Out R/L
  Amp-Out caps: ofs=0x00, nsteps=0x00, stepsize=0x00, mute=1
  Amp-Out vals:  [0x80 0x80]
  Pincap 0x00003737: IN OUT Detect Trigger ImpSense
    Vref caps: HIZ 50 GRD 80 100
  Pin Default 0x01a19020: [Jack] Mic at Ext Rear
    Conn = 1/8, Color = Pink
    DefAssociation = 0x2, Sequence = 0x0
  Pin-ctls: 0x24: IN VREF_80
  Unsolicited: tag=00, enabled=0
  Connection: 1
     0x26
Node 0x18 [Pin Complex] wcaps 0x400081: Stereo
  Pincap 0x00000024: IN Detect
  Pin Default 0x9933012e: [Fixed] CD at Int ATAPI
    Conn = ATAPI, Color = Unknown
    DefAssociation = 0x2, Sequence = 0xe
    Misc = NO_PRESENCE
  Pin-ctls: 0x20: IN
  Unsolicited: tag=00, enabled=0
Node 0x19 [Power Widget] wcaps 0x500500: Mono
  Power states:  D0 D3
  Power: setting=D0, actual=D0
  Connection: 2
     0x20 0x21
Node 0x1a [Pin Complex] wcaps 0x400000: Mono
  Pincap 0x00000020: IN
  Pin Default 0x99f301f0: [Fixed] Other at Int ATAPI
    Conn = ATAPI, Color = Unknown
    DefAssociation = 0xf, Sequence = 0x0
    Misc = NO_PRESENCE
  Pin-ctls: 0x20: IN
Node 0x1b [Pin Complex] wcaps 0x40030d: Stereo Digital Amp-Out
  Control: name="IEC958 Playback Volume", index=0, device=0
    ControlAmp: chs=3, dir=Out, idx=0, ofs=0
  Amp-Out caps: ofs=0x27, nsteps=0x27, stepsize=0x05, mute=1
  Amp-Out vals:  [0x27 0x27]
  Pincap 0x00000010: OUT
  Pin Default 0x014511f0: [Jack] SPDIF Out at Ext Rear
    Conn = Optical, Color = Black
    DefAssociation = 0xf, Sequence = 0x0
    Misc = NO_PRESENCE
  Pin-ctls: 0x40: OUT
  Connection: 1
     0x02
Node 0x1c [Pin Complex] wcaps 0x40020b: Stereo Digital Amp-In
  Amp-In caps: ofs=0x17, nsteps=0x1f, stepsize=0x05, mute=1
  Amp-In vals:  [0x97 0x97]
  Pincap 0x00000020: IN
  Pin Default 0x01c511f0: [Jack] SPDIF In at Ext Rear
    Conn = Optical, Color = Black
    DefAssociation = 0xf, Sequence = 0x0
    Misc = NO_PRESENCE
  Pin-ctls: 0x20: IN
Node 0x1d [Pin Complex] wcaps 0x40030d: Stereo Digital Amp-Out
  Control: name="HDMI Playback Volume", index=0, device=0
    ControlAmp: chs=3, dir=Out, idx=0, ofs=0
  Amp-Out caps: ofs=0x27, nsteps=0x27, stepsize=0x05, mute=1
  Amp-Out vals:  [0x27 0x27]
  Pincap 0x00000010: OUT
  Pin Default 0x985601f0: [Fixed] Digital Out at Int HDMI
    Conn = Digital, Color = Unknown
    DefAssociation = 0xf, Sequence = 0x0
    Misc = NO_PRESENCE
  Pin-ctls: 0x40: OUT
  Connection: 1
     0x0b
Node 0x1e [Audio Mixer] wcaps 0x200103: Stereo Amp-In
  Amp-In caps: ofs=0x00, nsteps=0x00, stepsize=0x00, mute=1
  Amp-In vals:  [0x80 0x80] [0x80 0x80]
  Connection: 2
     0x36 0x21
Node 0x1f [Pin Complex] wcaps 0x40000b: Stereo Amp-In
  Amp-In caps: ofs=0x00, nsteps=0x03, stepsize=0x17, mute=0
  Amp-In vals:  [0x00 0x00]
  Pincap 0x00000020: IN
  Pin Default 0x97a601f0: [Fixed] Mic at Int Riser
    Conn = Digital, Color = Unknown
    DefAssociation = 0xf, Sequence = 0x0
    Misc = NO_PRESENCE
  Pin-ctls: 0x14:
Node 0x20 [Audio Mixer] wcaps 0x20010b: Stereo Amp-In
  Control: name="Mic Playback Volume", index=0, device=0
    ControlAmp: chs=3, dir=In, idx=4, ofs=0
  Control: name="Mic Playback Switch", index=0, device=0
    ControlAmp: chs=3, dir=In, idx=4, ofs=0
  Control: name="Front Mic Playback Volume", index=0, device=0
    ControlAmp: chs=3, dir=In, idx=0, ofs=0
  Control: name="Front Mic Playback Switch", index=0, device=0
    ControlAmp: chs=3, dir=In, idx=0, ofs=0
  Control: name="Line Playback Volume", index=0, device=0
    ControlAmp: chs=3, dir=In, idx=1, ofs=0
  Control: name="Line Playback Switch", index=0, device=0
    ControlAmp: chs=3, dir=In, idx=1, ofs=0
  Control: name="Front Line Playback Volume", index=0, device=0
    ControlAmp: chs=3, dir=In, idx=2, ofs=0
  Control: name="Front Line Playback Switch", index=0, device=0
    ControlAmp: chs=3, dir=In, idx=2, ofs=0
  Control: name="CD Playback Volume", index=0, device=0
    ControlAmp: chs=3, dir=In, idx=6, ofs=0
  Control: name="CD Playback Switch", index=0, device=0
    ControlAmp: chs=3, dir=In, idx=6, ofs=0
  Control: name="Aux Playback Volume", index=0, device=0
    ControlAmp: chs=3, dir=In, idx=2, ofs=0
  Control: name="Aux Playback Switch", index=0, device=0
    ControlAmp: chs=3, dir=In, idx=2, ofs=0
  Amp-In caps: ofs=0x17, nsteps=0x1f, stepsize=0x05, mute=1
  Amp-In vals:  [0x80 0x80] [0x80 0x80] [0x80 0x80] [0x80 0x80] [0x80 0x80] [0x80 0x80] [0x17 0x17] [0x80 0x80]
  Connection: 8
     0x39 0x33 0x38 0x3d 0x34 0x3b 0x18 0x1a
Node 0x21 [Audio Selector] wcaps 0x30010d: Stereo Amp-Out
  Control: name="Analog Mix Playback Volume", index=0, device=0
    ControlAmp: chs=3, dir=Out, idx=0, ofs=0
  Control: name="Analog Mix Playback Switch", index=0, device=0
    ControlAmp: chs=3, dir=Out, idx=0, ofs=0
  Amp-Out caps: ofs=0x1f, nsteps=0x1f, stepsize=0x05, mute=1
  Amp-Out vals:  [0x1f 0x1f]
  Connection: 1
     0x20
Node 0x22 [Audio Mixer] wcaps 0x200103: Stereo Amp-In
  Control: name="Speaker Playback Switch", index=0, device=0
    ControlAmp: chs=3, dir=In, idx=2, ofs=0
  Control: name="Headphone Playback Switch", index=0, device=0
    ControlAmp: chs=3, dir=In, idx=2, ofs=0
  Amp-In caps: ofs=0x00, nsteps=0x00, stepsize=0x00, mute=1
  Amp-In vals:  [0x00 0x00] [0x00 0x00]
  Connection: 2
     0x37 0x21
Node 0x23 [Vendor Defined Widget] wcaps 0xf00100: Mono
  Connection: 18
     0x11* 0x12 0x13 0x14 0x15 0x16 0x17 0x18 0x24 0x25 0x38 0x39 0x3a 0x3b 0x3c 0x3d 0x20 0x21
Node 0x24 [Pin Complex] wcaps 0x40098d: Stereo Amp-Out R/L
  Amp-Out caps: ofs=0x00, nsteps=0x00, stepsize=0x00, mute=1
  Amp-Out vals:  [0x00 0x00]
  Pincap 0x00000037: IN OUT Detect Trigger ImpSense
  Pin Default 0x01016011: [Jack] Line Out at Ext Rear
    Conn = 1/8, Color = Orange
    DefAssociation = 0x1, Sequence = 0x1
  Pin-ctls: 0x40: OUT
  Unsolicited: tag=00, enabled=0
  Connection: 1
     0x27
Node 0x25 [Vendor Defined Widget] wcaps 0xf00000: Mono
Node 0x26 [Audio Mixer] wcaps 0x200103: Stereo Amp-In
  Amp-In caps: ofs=0x00, nsteps=0x00, stepsize=0x00, mute=1
  Amp-In vals:  [0x80 0x80] [0x80 0x80]
  Connection: 2
     0x32 0x21
Node 0x27 [Audio Mixer] wcaps 0x200103: Stereo Amp-In
  Control: name="Center Playback Switch", index=0, device=0
    ControlAmp: chs=1, dir=In, idx=2, ofs=0
  Control: name="LFE Playback Switch", index=0, device=0
    ControlAmp: chs=2, dir=In, idx=2, ofs=0
  Amp-In caps: ofs=0x00, nsteps=0x00, stepsize=0x00, mute=1
  Amp-In vals:  [0x80 0x80] [0x80 0x80]
  Connection: 2
     0x05 0x21
Node 0x28 [Audio Mixer] wcaps 0x200103: Stereo Amp-In
  Amp-In caps: ofs=0x00, nsteps=0x00, stepsize=0x00, mute=1
  Amp-In vals:  [0x80 0x80] [0x80 0x80]
  Connection: 2
     0x0a 0x21
Node 0x29 [Audio Mixer] wcaps 0x200103: Stereo Amp-In
  Control: name="Front Playback Switch", index=0, device=0
    ControlAmp: chs=3, dir=In, idx=2, ofs=0
  Amp-In caps: ofs=0x00, nsteps=0x00, stepsize=0x00, mute=1
  Amp-In vals:  [0x00 0x00] [0x00 0x00]
  Connection: 2
     0x04 0x21
Node 0x2a [Audio Mixer] wcaps 0x200103: Stereo Amp-In
  Control: name="Surround Playback Switch", index=0, device=0
    ControlAmp: chs=3, dir=In, idx=2, ofs=0
  Amp-In caps: ofs=0x00, nsteps=0x00, stepsize=0x00, mute=1
  Amp-In vals:  [0x80 0x80] [0x80 0x80]
  Connection: 2
     0x06 0x21
Node 0x2b [Audio Mixer] wcaps 0x200103: Stereo Amp-In
  Amp-In caps: ofs=0x00, nsteps=0x00, stepsize=0x00, mute=1
  Amp-In vals:  [0x80 0x80] [0x80 0x80]
  Connection: 2
     0x30 0x21
Node 0x2c [Audio Mixer] wcaps 0x200103: Stereo Amp-In
  Amp-In caps: ofs=0x00, nsteps=0x00, stepsize=0x00, mute=1
  Amp-In vals:  [0x80 0x80] [0x80 0x80]
  Connection: 2
     0x31 0x21
Node 0x2d [Audio Mixer] wcaps 0x200100: Mono
  Connection: 1
     0x1e
Node 0x2e [Vendor Defined Widget] wcaps 0xf00000: Mono
Node 0x2f [Vendor Defined Widget] wcaps 0xf00100: Mono
  Connection: 6
     0x11* 0x12 0x14 0x15 0x16 0x17
Node 0x30 [Audio Selector] wcaps 0x300101: Stereo
  Connection: 3
     0x03* 0x04 0x06
Node 0x31 [Audio Selector] wcaps 0x300101: Stereo
  Connection: 2
     0x04* 0x0a
Node 0x32 [Audio Selector] wcaps 0x300101: Stereo
  Connection: 2
     0x05* 0x04
Node 0x33 [Audio Selector] wcaps 0x300101: Stereo
  Connection: 3
     0x3a* 0x25 0x24
Node 0x34 [Audio Selector] wcaps 0x300101: Stereo
  Connection: 3
     0x3c* 0x25 0x24
Node 0x35 [Vendor Defined Widget] wcaps 0xf00000: Mono
Node 0x36 [Audio Selector] wcaps 0x300101: Stereo
  Connection: 3
     0x03 0x04* 0x06
Node 0x37 [Audio Selector] wcaps 0x300101: Stereo
  Connection: 3
     0x03 0x04* 0x06
Node 0x38 [Audio Selector] wcaps 0x30010d: Stereo Amp-Out
  Amp-Out caps: ofs=0x00, nsteps=0x03, stepsize=0x27, mute=0
  Amp-Out vals:  [0x00 0x00]
  Connection: 1
     0x11
Node 0x39 [Audio Selector] wcaps 0x30010d: Stereo Amp-Out
  Control: name="Front Mic Boost", index=0, device=0
    ControlAmp: chs=3, dir=Out, idx=1, ofs=0
  Amp-Out caps: ofs=0x00, nsteps=0x03, stepsize=0x27, mute=0
  Amp-Out vals:  [0x00 0x00]
  Connection: 1
     0x14
Node 0x3a [Audio Selector] wcaps 0x30010d: Stereo Amp-Out
  Amp-Out caps: ofs=0x00, nsteps=0x03, stepsize=0x27, mute=0
  Amp-Out vals:  [0x00 0x00]
  Connection: 1
     0x15
Node 0x3b [Vendor Defined Widget] wcaps 0xf00000: Mono
Node 0x3c [Audio Selector] wcaps 0x30010d: Stereo Amp-Out
  Control: name="Mic Boost", index=0, device=0
    ControlAmp: chs=3, dir=Out, idx=4, ofs=0
  Amp-Out caps: ofs=0x00, nsteps=0x03, stepsize=0x27, mute=0
  Amp-Out vals:  [0x00 0x00]
  Connection: 1
     0x17
Node 0x3d [Audio Selector] wcaps 0x30010d: Stereo Amp-Out
  Amp-Out caps: ofs=0x00, nsteps=0x03, stepsize=0x27, mute=0
  Amp-Out vals:  [0x00 0x00]
  Connection: 1
     0x12
--endcollapse--


!!ALSA Device nodes
!!-----------------

crw-rw----+ 1 root audio 116, 9 Dec 21 09:51 /dev/snd/controlC0
crw-rw----+ 1 root audio 116, 8 Dec 21 09:51 /dev/snd/hwC0D1
crw-rw----+ 1 root audio 116, 7 Dec 21 09:59 /dev/snd/pcmC0D0c
crw-rw----+ 1 root audio 116, 6 Dec 21 09:59 /dev/snd/pcmC0D0p
crw-rw----+ 1 root audio 116, 5 Dec 21 09:51 /dev/snd/pcmC0D1c
crw-rw----+ 1 root audio 116, 4 Dec 21 09:51 /dev/snd/pcmC0D1p
crw-rw----+ 1 root audio 116, 3 Dec 21 09:51 /dev/snd/seq
crw-rw----+ 1 root audio 116, 2 Dec 21 09:51 /dev/snd/timer

/dev/snd/by-path:
total 0
drwxr-xr-x. 2 root root  60 Dec 21 09:51 .
drwxr-xr-x. 3 root root 220 Dec 21 09:51 ..
lrwxrwxrwx. 1 root root  12 Dec 21 09:51 pci-0000:00:1b.0 -> ../controlC0


!!ALSA configuration files
!!------------------------

!!System wide config file (/etc/asound.conf)

#
# Place your global alsa-lib configuration here...
#

@hooks [
	{
		func load
		files [
			"/etc/alsa/my_alsa.conf"
		]
		errors false
	}
]


!!Aplay/Arecord output
!!------------

APLAY

**** List of PLAYBACK Hardware Devices ****
card 0: MID [HDA Intel MID], device 0: AD198x Analog [AD198x Analog]
  Subdevices: 1/1
  Subdevice #0: subdevice #0
card 0: MID [HDA Intel MID], device 1: AD198x Digital [AD198x Digital]
  Subdevices: 1/1
  Subdevice #0: subdevice #0

ARECORD

**** List of CAPTURE Hardware Devices ****
card 0: MID [HDA Intel MID], device 0: AD198x Analog [AD198x Analog]
  Subdevices: 3/3
  Subdevice #0: subdevice #0
  Subdevice #1: subdevice #1
  Subdevice #2: subdevice #2
card 0: MID [HDA Intel MID], device 1: AD198x Digital [AD198x Digital]
  Subdevices: 1/1
  Subdevice #0: subdevice #0

!!Amixer output
!!-------------

!!-------Mixer controls for card 0 [MID]

Card hw:0 'MID'/'HDA Intel MID at 0x942c0000 irq 46'
  Mixer name	: 'Analog Devices AD1989A'
  Components	: 'HDA:11d4989a,bfd80000,00100300'
  Controls      : 50
  Simple ctrls  : 28
Simple mixer control 'Master',0
  Capabilities: pvolume pvolume-joined pswitch pswitch-joined penum
  Playback channels: Mono
  Limits: Playback 0 - 39
  Mono: Playback 39 [100%] [0.00dB] [on]
Simple mixer control 'Headphone',0
  Capabilities: pswitch penum
  Playback channels: Front Left - Front Right
  Mono:
  Front Left: Playback [on]
  Front Right: Playback [on]
Simple mixer control 'Speaker',0
  Capabilities: pswitch penum
  Playback channels: Front Left - Front Right
  Mono:
  Front Left: Playback [on]
  Front Right: Playback [on]
Simple mixer control 'PCM',0
  Capabilities: pvolume penum
  Playback channels: Front Left - Front Right
  Limits: Playback 0 - 255
  Mono:
  Front Left: Playback 255 [100%] [0.00dB]
  Front Right: Playback 255 [100%] [0.00dB]
Simple mixer control 'Front',0
  Capabilities: pvolume pswitch penum
  Playback channels: Front Left - Front Right
  Limits: Playback 0 - 39
  Mono:
  Front Left: Playback 39 [100%] [0.00dB] [on]
  Front Right: Playback 39 [100%] [0.00dB] [on]
Simple mixer control 'Front Line',0
  Capabilities: pvolume pswitch penum
  Playback channels: Front Left - Front Right
  Limits: Playback 0 - 31
  Mono:
  Front Left: Playback 0 [0%] [-34.50dB] [off]
  Front Right: Playback 0 [0%] [-34.50dB] [off]
Simple mixer control 'Front Mic',0
  Capabilities: pvolume pswitch penum
  Playback channels: Front Left - Front Right
  Limits: Playback 0 - 31
  Mono:
  Front Left: Playback 0 [0%] [-34.50dB] [off]
  Front Right: Playback 0 [0%] [-34.50dB] [off]
Simple mixer control 'Front Mic Boost',0
  Capabilities: volume penum
  Playback channels: Front Left - Front Right
  Capture channels: Front Left - Front Right
  Limits: 0 - 3
  Front Left: 0 [0%]
  Front Right: 0 [0%]
Simple mixer control 'Surround',0
  Capabilities: pvolume pswitch penum
  Playback channels: Front Left - Front Right
  Limits: Playback 0 - 39
  Mono:
  Front Left: Playback 0 [0%] [-58.50dB] [off]
  Front Right: Playback 0 [0%] [-58.50dB] [off]
Simple mixer control 'Center',0
  Capabilities: pvolume pvolume-joined pswitch pswitch-joined penum
  Playback channels: Mono
  Limits: Playback 0 - 39
  Mono: Playback 0 [0%] [-58.50dB] [off]
Simple mixer control 'LFE',0
  Capabilities: pvolume pvolume-joined pswitch pswitch-joined penum
  Playback channels: Mono
  Limits: Playback 0 - 39
  Mono: Playback 0 [0%] [-58.50dB] [off]
Simple mixer control 'Line',0
  Capabilities: pvolume pswitch penum
  Playback channels: Front Left - Front Right
  Limits: Playback 0 - 31
  Mono:
  Front Left: Playback 0 [0%] [-34.50dB] [off]
  Front Right: Playback 0 [0%] [-34.50dB] [off]
Simple mixer control 'CD',0
  Capabilities: pvolume pswitch penum
  Playback channels: Front Left - Front Right
  Limits: Playback 0 - 31
  Mono:
  Front Left: Playback 23 [74%] [0.00dB] [on]
  Front Right: Playback 23 [74%] [0.00dB] [on]
Simple mixer control 'Mic',0
  Capabilities: pvolume pswitch penum
  Playback channels: Front Left - Front Right
  Limits: Playback 0 - 31
  Mono:
  Front Left: Playback 0 [0%] [-34.50dB] [off]
  Front Right: Playback 0 [0%] [-34.50dB] [off]
Simple mixer control 'Mic Boost',0
  Capabilities: volume penum
  Playback channels: Front Left - Front Right
  Capture channels: Front Left - Front Right
  Limits: 0 - 3
  Front Left: 0 [0%]
  Front Right: 0 [0%]
Simple mixer control 'IEC958',0
  Capabilities: pvolume pswitch pswitch-joined cswitch cswitch-joined penum
  Playback channels: Front Left - Front Right
  Capture channels: Mono
  Limits: Playback 0 - 39
  Mono: Capture [off]
  Front Left: Playback 39 [100%] [0.00dB] [off]
  Front Right: Playback 39 [100%] [0.00dB] [off]
Simple mixer control 'IEC958 Default PCM',0
  Capabilities: pswitch pswitch-joined penum
  Playback channels: Mono
  Mono: Playback [on]
Simple mixer control 'Beep',0
  Capabilities: pvolume pvolume-joined pswitch pswitch-joined penum
  Playback channels: Mono
  Limits: Playback 0 - 15
  Mono: Playback 15 [100%] [0.00dB] [off]
Simple mixer control 'Aux',0
  Capabilities: pvolume pswitch penum
  Playback channels: Front Left - Front Right
  Limits: Playback 0 - 31
  Mono:
  Front Left: Playback 0 [0%] [-34.50dB] [off]
  Front Right: Playback 0 [0%] [-34.50dB] [off]
Simple mixer control 'Capture',0
  Capabilities: cvolume cswitch penum
  Capture channels: Front Left - Front Right
  Limits: Capture 0 - 54
  Front Left: Capture 47 [87%] [12.00dB] [on]
  Front Right: Capture 47 [87%] [12.00dB] [on]
Simple mixer control 'Capture',1
  Capabilities: cvolume cswitch penum
  Capture channels: Front Left - Front Right
  Limits: Capture 0 - 54
  Front Left: Capture 39 [72%] [0.00dB] [off]
  Front Right: Capture 39 [72%] [0.00dB] [off]
Simple mixer control 'Capture',2
  Capabilities: cvolume cswitch penum
  Capture channels: Front Left - Front Right
  Limits: Capture 0 - 54
  Front Left: Capture 39 [72%] [0.00dB] [off]
  Front Right: Capture 39 [72%] [0.00dB] [off]
Simple mixer control 'Analog Mix',0
  Capabilities: pvolume pswitch penum
  Playback channels: Front Left - Front Right
  Limits: Playback 0 - 31
  Mono:
  Front Left: Playback 31 [100%] [0.00dB] [on]
  Front Right: Playback 31 [100%] [0.00dB] [on]
Simple mixer control 'Digital',0
  Capabilities: cvolume penum
  Capture channels: Front Left - Front Right
  Limits: Capture 0 - 120
  Front Left: Capture 60 [50%] [0.00dB]
  Front Right: Capture 60 [50%] [0.00dB]
Simple mixer control 'HDMI',0
  Capabilities: pvolume penum
  Playback channels: Front Left - Front Right
  Limits: Playback 0 - 39
  Mono:
  Front Left: Playback 39 [100%] [0.00dB]
  Front Right: Playback 39 [100%] [0.00dB]
Simple mixer control 'Input Source',0
  Capabilities: cenum
  Items: 'Mic' 'Front Mic' 'Line' 'Front Line' 'CD' 'Aux' 'Mix'
  Item0: 'Mic'
Simple mixer control 'Input Source',1
  Capabilities: cenum
  Items: 'Mic' 'Front Mic' 'Line' 'Front Line' 'CD' 'Aux' 'Mix'
  Item0: 'Mic'
Simple mixer control 'Input Source',2
  Capabilities: cenum
  Items: 'Mic' 'Front Mic' 'Line' 'Front Line' 'CD' 'Aux' 'Mix'
  Item0: 'Mic'


!!Alsactl output
!!-------------

--startcollapse--
state.MID {
	control.1 {
		comment.access 'read write'
		comment.type INTEGER
		comment.count 2
		comment.range '0 - 39'
		comment.dbmin -5850
		comment.dbmax 0
		iface MIXER
		name 'Front Playback Volume'
		value.0 39
		value.1 39
	}
	control.2 {
		comment.access 'read write'
		comment.type BOOLEAN
		comment.count 2
		iface MIXER
		name 'Front Playback Switch'
		value.0 true
		value.1 true
	}
	control.3 {
		comment.access 'read write'
		comment.type INTEGER
		comment.count 2
		comment.range '0 - 39'
		comment.dbmin -5850
		comment.dbmax 0
		iface MIXER
		name 'Surround Playback Volume'
		value.0 0
		value.1 0
	}
	control.4 {
		comment.access 'read write'
		comment.type BOOLEAN
		comment.count 2
		iface MIXER
		name 'Surround Playback Switch'
		value.0 false
		value.1 false
	}
	control.5 {
		comment.access 'read write'
		comment.type INTEGER
		comment.count 1
		comment.range '0 - 39'
		comment.dbmin -5850
		comment.dbmax 0
		iface MIXER
		name 'Center Playback Volume'
		value 0
	}
	control.6 {
		comment.access 'read write'
		comment.type INTEGER
		comment.count 1
		comment.range '0 - 39'
		comment.dbmin -5850
		comment.dbmax 0
		iface MIXER
		name 'LFE Playback Volume'
		value 0
	}
	control.7 {
		comment.access 'read write'
		comment.type BOOLEAN
		comment.count 1
		iface MIXER
		name 'Center Playback Switch'
		value false
	}
	control.8 {
		comment.access 'read write'
		comment.type BOOLEAN
		comment.count 1
		iface MIXER
		name 'LFE Playback Switch'
		value false
	}
	control.9 {
		comment.access 'read write'
		comment.type BOOLEAN
		comment.count 2
		iface MIXER
		name 'Speaker Playback Switch'
		value.0 true
		value.1 true
	}
	control.10 {
		comment.access 'read write'
		comment.type BOOLEAN
		comment.count 2
		iface MIXER
		name 'Headphone Playback Switch'
		value.0 true
		value.1 true
	}
	control.11 {
		comment.access 'read write'
		comment.type INTEGER
		comment.count 2
		comment.range '0 - 31'
		comment.dbmin -3450
		comment.dbmax 1200
		iface MIXER
		name 'Mic Playback Volume'
		value.0 0
		value.1 0
	}
	control.12 {
		comment.access 'read write'
		comment.type BOOLEAN
		comment.count 2
		iface MIXER
		name 'Mic Playback Switch'
		value.0 false
		value.1 false
	}
	control.13 {
		comment.access 'read write'
		comment.type INTEGER
		comment.count 2
		comment.range '0 - 3'
		comment.dbmin 0
		comment.dbmax 3000
		iface MIXER
		name 'Mic Boost'
		value.0 0
		value.1 0
	}
	control.14 {
		comment.access 'read write'
		comment.type INTEGER
		comment.count 2
		comment.range '0 - 31'
		comment.dbmin -3450
		comment.dbmax 1200
		iface MIXER
		name 'Front Mic Playback Volume'
		value.0 0
		value.1 0
	}
	control.15 {
		comment.access 'read write'
		comment.type BOOLEAN
		comment.count 2
		iface MIXER
		name 'Front Mic Playback Switch'
		value.0 false
		value.1 false
	}
	control.16 {
		comment.access 'read write'
		comment.type INTEGER
		comment.count 2
		comment.range '0 - 3'
		comment.dbmin 0
		comment.dbmax 3000
		iface MIXER
		name 'Front Mic Boost'
		value.0 0
		value.1 0
	}
	control.17 {
		comment.access 'read write'
		comment.type INTEGER
		comment.count 2
		comment.range '0 - 31'
		comment.dbmin -3450
		comment.dbmax 1200
		iface MIXER
		name 'Line Playback Volume'
		value.0 0
		value.1 0
	}
	control.18 {
		comment.access 'read write'
		comment.type BOOLEAN
		comment.count 2
		iface MIXER
		name 'Line Playback Switch'
		value.0 false
		value.1 false
	}
	control.19 {
		comment.access 'read write'
		comment.type INTEGER
		comment.count 2
		comment.range '0 - 31'
		comment.dbmin -3450
		comment.dbmax 1200
		iface MIXER
		name 'Front Line Playback Volume'
		value.0 0
		value.1 0
	}
	control.20 {
		comment.access 'read write'
		comment.type BOOLEAN
		comment.count 2
		iface MIXER
		name 'Front Line Playback Switch'
		value.0 false
		value.1 false
	}
	control.21 {
		comment.access 'read write'
		comment.type INTEGER
		comment.count 2
		comment.range '0 - 31'
		comment.dbmin -3450
		comment.dbmax 1200
		iface MIXER
		name 'CD Playback Volume'
		value.0 23
		value.1 23
	}
	control.22 {
		comment.access 'read write'
		comment.type BOOLEAN
		comment.count 2
		iface MIXER
		name 'CD Playback Switch'
		value.0 true
		value.1 true
	}
	control.23 {
		comment.access 'read write'
		comment.type INTEGER
		comment.count 2
		comment.range '0 - 31'
		comment.dbmin -3450
		comment.dbmax 1200
		iface MIXER
		name 'Aux Playback Volume'
		value.0 0
		value.1 0
	}
	control.24 {
		comment.access 'read write'
		comment.type BOOLEAN
		comment.count 2
		iface MIXER
		name 'Aux Playback Switch'
		value.0 false
		value.1 false
	}
	control.25 {
		comment.access 'read write'
		comment.type INTEGER
		comment.count 2
		comment.range '0 - 31'
		comment.dbmin -4650
		comment.dbmax 0
		iface MIXER
		name 'Analog Mix Playback Volume'
		value.0 31
		value.1 31
	}
	control.26 {
		comment.access 'read write'
		comment.type BOOLEAN
		comment.count 2
		iface MIXER
		name 'Analog Mix Playback Switch'
		value.0 true
		value.1 true
	}
	control.27 {
		comment.access 'read write'
		comment.type INTEGER
		comment.count 2
		comment.range '0 - 54'
		comment.dbmin -5850
		comment.dbmax 2250
		iface MIXER
		name 'Capture Volume'
		value.0 47
		value.1 47
	}
	control.28 {
		comment.access 'read write'
		comment.type BOOLEAN
		comment.count 2
		iface MIXER
		name 'Capture Switch'
		value.0 true
		value.1 true
	}
	control.29 {
		comment.access 'read write'
		comment.type INTEGER
		comment.count 2
		comment.range '0 - 54'
		comment.dbmin -5850
		comment.dbmax 2250
		iface MIXER
		name 'Capture Volume'
		index 1
		value.0 39
		value.1 39
	}
	control.30 {
		comment.access 'read write'
		comment.type BOOLEAN
		comment.count 2
		iface MIXER
		name 'Capture Switch'
		index 1
		value.0 false
		value.1 false
	}
	control.31 {
		comment.access 'read write'
		comment.type INTEGER
		comment.count 2
		comment.range '0 - 54'
		comment.dbmin -5850
		comment.dbmax 2250
		iface MIXER
		name 'Capture Volume'
		index 2
		value.0 39
		value.1 39
	}
	control.32 {
		comment.access 'read write'
		comment.type BOOLEAN
		comment.count 2
		iface MIXER
		name 'Capture Switch'
		index 2
		value.0 false
		value.1 false
	}
	control.33 {
		comment.access 'read write'
		comment.type ENUMERATED
		comment.count 1
		comment.item.0 Mic
		comment.item.1 'Front Mic'
		comment.item.2 Line
		comment.item.3 'Front Line'
		comment.item.4 CD
		comment.item.5 Aux
		comment.item.6 Mix
		iface MIXER
		name 'Input Source'
		value Mic
	}
	control.34 {
		comment.access 'read write'
		comment.type ENUMERATED
		comment.count 1
		comment.item.0 Mic
		comment.item.1 'Front Mic'
		comment.item.2 Line
		comment.item.3 'Front Line'
		comment.item.4 CD
		comment.item.5 Aux
		comment.item.6 Mix
		iface MIXER
		name 'Input Source'
		index 1
		value Mic
	}
	control.35 {
		comment.access 'read write'
		comment.type ENUMERATED
		comment.count 1
		comment.item.0 Mic
		comment.item.1 'Front Mic'
		comment.item.2 Line
		comment.item.3 'Front Line'
		comment.item.4 CD
		comment.item.5 Aux
		comment.item.6 Mix
		iface MIXER
		name 'Input Source'
		index 2
		value Mic
	}
	control.36 {
		comment.access 'read write'
		comment.type INTEGER
		comment.count 2
		comment.range '0 - 39'
		comment.dbmin -5850
		comment.dbmax 0
		iface MIXER
		name 'IEC958 Playback Volume'
		value.0 39
		value.1 39
	}
	control.37 {
		comment.access 'read write'
		comment.type INTEGER
		comment.count 2
		comment.range '0 - 39'
		comment.dbmin -5850
		comment.dbmax 0
		iface MIXER
		name 'HDMI Playback Volume'
		value.0 39
		value.1 39
	}
	control.38 {
		comment.access read
		comment.type IEC958
		comment.count 1
		iface MIXER
		name 'IEC958 Playback Con Mask'
		value '0fff000000000000000000000000000000000000000000000000000000000000000000000000000000000000000000000000000000000000000000000000000000000000000000000000000000000000000000000000000000000000000000000000000000000000000000000000000000000000000000000000000000000000000000000000000000000000000000000000000000000000000000000000000000000000000000000000000000000000'
	}
	control.39 {
		comment.access read
		comment.type IEC958
		comment.count 1
		iface MIXER
		name 'IEC958 Playback Pro Mask'
		value '0f00000000000000000000000000000000000000000000000000000000000000000000000000000000000000000000000000000000000000000000000000000000000000000000000000000000000000000000000000000000000000000000000000000000000000000000000000000000000000000000000000000000000000000000000000000000000000000000000000000000000000000000000000000000000000000000000000000000000000'
	}
	control.40 {
		comment.access 'read write'
		comment.type IEC958
		comment.count 1
		iface MIXER
		name 'IEC958 Playback Default'
		value '0400000000000000000000000000000000000000000000000000000000000000000000000000000000000000000000000000000000000000000000000000000000000000000000000000000000000000000000000000000000000000000000000000000000000000000000000000000000000000000000000000000000000000000000000000000000000000000000000000000000000000000000000000000000000000000000000000000000000000'
	}
	control.41 {
		comment.access 'read write'
		comment.type BOOLEAN
		comment.count 1
		iface MIXER
		name 'IEC958 Playback Switch'
		value false
	}
	control.42 {
		comment.access 'read write'
		comment.type BOOLEAN
		comment.count 1
		iface MIXER
		name 'IEC958 Default PCM Playback Switch'
		value true
	}
	control.43 {
		comment.access 'read write'
		comment.type BOOLEAN
		comment.count 1
		iface MIXER
		name 'IEC958 Capture Switch'
		value false
	}
	control.44 {
		comment.access read
		comment.type IEC958
		comment.count 1
		iface MIXER
		name 'IEC958 Capture Default'
		value '0400000000000000000000000000000000000000000000000000000000000000000000000000000000000000000000000000000000000000000000000000000000000000000000000000000000000000000000000000000000000000000000000000000000000000000000000000000000000000000000000000000000000000000000000000000000000000000000000000000000000000000000000000000000000000000000000000000000000000'
	}
	control.45 {
		comment.access 'read write'
		comment.type INTEGER
		comment.count 1
		comment.range '0 - 15'
		comment.dbmin -4500
		comment.dbmax 0
		iface MIXER
		name 'Beep Playback Volume'
		value 15
	}
	control.46 {
		comment.access 'read write'
		comment.type BOOLEAN
		comment.count 1
		iface MIXER
		name 'Beep Playback Switch'
		value false
	}
	control.47 {
		comment.access 'read write'
		comment.type INTEGER
		comment.count 1
		comment.range '0 - 39'
		comment.dbmin -5850
		comment.dbmax 0
		iface MIXER
		name 'Master Playback Volume'
		value 39
	}
	control.48 {
		comment.access 'read write'
		comment.type BOOLEAN
		comment.count 1
		iface MIXER
		name 'Master Playback Switch'
		value true
	}
	control.49 {
		comment.access 'read write user'
		comment.type INTEGER
		comment.count 2
		comment.range '0 - 120'
		comment.tlv '0000000100000008fffff44800000032'
		comment.dbmin -3000
		comment.dbmax 3000
		iface MIXER
		name 'Digital Capture Volume'
		value.0 60
		value.1 60
	}
	control.50 {
		comment.access 'read write user'
		comment.type INTEGER
		comment.count 2
		comment.range '0 - 255'
		comment.tlv '0000000100000008ffffec1400000014'
		comment.dbmin -5100
		comment.dbmax 0
		iface MIXER
		name 'PCM Playback Volume'
		value.0 255
		value.1 255
	}
}
--endcollapse--


!!All Loaded Modules
!!------------------

Module
sunrpc
cpufreq_ondemand
acpi_cpufreq
mperf
nf_conntrack_netbios_ns
ip6t_REJECT
ip6t_ipv6header
nf_conntrack_ipv6
ip6table_filter
ip6_tables
ipv6
snd_hda_codec_analog
microcode
snd_hda_intel
snd_hda_codec
snd_hwdep
snd_seq
snd_seq_device
i2c_isch
i2c_core
snd_pcm
serio_raw
joydev
lpc_sch
snd_timer
mfd_core
snd
e1000e
soundcore
snd_page_alloc
ata_generic
pata_acpi
usb_storage
sdhci_pci
sdhci
video
mmc_core
pata_sch
output


!!Sysfs Files
!!-----------

/sys/class/sound/hwC0D1/init_pin_configs:
0x11 0x02214030
0x12 0x01014010
0x13 0x991301f0
0x14 0x02a19040
0x15 0x01813021
0x16 0x01011012
0x17 0x01a19020
0x18 0x9933012e
0x1a 0x99f301f0
0x1b 0x014511f0
0x1c 0x01c511f0
0x1d 0x985601f0
0x1f 0x97a601f0
0x24 0x01016011

/sys/class/sound/hwC0D1/driver_pin_configs:

/sys/class/sound/hwC0D1/user_pin_configs:

/sys/class/sound/hwC0D1/init_verbs:


!!ALSA/HDA dmesg
!!------------------

[   12.904226] udev[420]: renamed network interface eth0 to eth1
[   13.616629] HDA Intel 0000:00:1b.0: PCI INT A -> GSI 16 (level, low) -> IRQ 16
[   13.616644] hda_intel: codec_mask forced to 0x2
[   13.616775] HDA Intel 0000:00:1b.0: irq 46 for MSI/MSI-X
[   13.616876] HDA Intel 0000:00:1b.0: setting latency timer to 64
[   13.855147] microcode: CPU0 sig=0x106c2, pf=0x1, revision=0x211
--
[   15.685261] microcode: CPU1 updated to revision 0x217, date = 2009-04-10
[   16.629269] ALSA sound/pci/hda/hda_intel.c:710: azx_get_response timeout, switching to polling mode: last cmd=0x100f0001
[   16.726870] hda_codec: AD1989A: BIOS auto-probing.
[   16.726888] ALSA sound/pci/hda/hda_codec.c:4435: autoconfig: line_outs=3 (0x12/0x16/0x24/0x0/0x0)
[   16.726902] ALSA sound/pci/hda/hda_codec.c:4439:    speaker_outs=1 (0x13/0x0/0x0/0x0/0x0)
[   16.726915] ALSA sound/pci/hda/hda_codec.c:4443:    hp_outs=1 (0x11/0x0/0x0/0x0/0x0)
[   16.726927] ALSA sound/pci/hda/hda_codec.c:4444:    mono: mono_out=0x0
[   16.726937] ALSA sound/pci/hda/hda_codec.c:4447:    dig-out=0x1b/0x1d
[   16.726947] ALSA sound/pci/hda/hda_codec.c:4455:    inputs: mic=0x17, fmic=0x14, line=0x15, fline=0x0, cd=0x18, aux=0x0
[   16.726961] ALSA sound/pci/hda/hda_codec.c:4457:    dig-in=0x1c
[   17.954156] usb 4-1: USB disconnect, address 2


