Slot:	00:00.0
Class:	Host bridge [0600]
Vendor:	Intel Corporation [8086]
Device:	System Controller Hub (SCH Poulsbo) [8100]
SVendor:	Intel Corporation [8086]
SDevice:	Device [8119]
Rev:	07
00: 86 80 00 81 07 00 00 00 07 00 00 06 00 00 00 00
10: 00 00 00 00 00 00 00 00 00 00 00 00 00 00 00 00
20: 00 00 00 00 00 00 00 00 00 00 00 00 86 80 19 81
30: 00 00 00 00 00 00 00 00 00 00 00 00 00 00 00 00

Slot:	00:02.0
Class:	VGA compatible controller [0300]
Vendor:	Intel Corporation [8086]
Device:	System Controller Hub (SCH Poulsbo) Graphics Controller [8108]
SVendor:	Intel Corporation [8086]
SDevice:	Device [8119]
Rev:	07
00: 86 80 08 81 07 00 10 00 07 00 00 03 00 00 00 00
10: 00 00 20 94 71 50 00 00 00 00 00 80 00 00 28 94
20: 00 00 00 00 00 00 00 00 00 00 00 00 86 80 19 81
30: 00 00 00 00 d0 00 00 00 00 00 00 00 0b 01 00 00

Slot:	00:1b.0
Class:	Audio device [0403]
Vendor:	Intel Corporation [8086]
Device:	System Controller Hub (SCH Poulsbo) HD Audio Controller [811b]
SVendor:	Intel Corporation [8086]
SDevice:	Device [8119]
Rev:	07
00: 86 80 1b 81 06 00 10 00 07 00 03 04 00 00 00 00
10: 04 00 2c 94 00 00 00 00 00 00 00 00 00 00 00 00
20: 00 00 00 00 00 00 00 00 00 00 00 00 86 80 19 81
30: 00 00 00 00 50 00 00 00 00 00 00 00 0b 01 00 00

Slot:	00:1c.0
Class:	PCI bridge [0604]
Vendor:	Intel Corporation [8086]
Device:	System Controller Hub (SCH Poulsbo) PCI Express Port 1 [8110]
Rev:	07
00: 86 80 10 81 07 00 10 00 07 00 04 06 00 00 81 00
10: 00 00 00 00 00 00 00 00 00 01 01 00 40 40 00 00
20: 20 93 10 94 00 90 f0 90 00 00 00 00 00 00 00 00
30: 00 00 00 00 40 00 00 00 00 00 00 00 0b 01 00 00

Slot:	00:1c.1
Class:	PCI bridge [0604]
Vendor:	Intel Corporation [8086]
Device:	System Controller Hub (SCH Poulsbo) PCI Express Port 2 [8112]
Rev:	07
00: 86 80 12 81 07 00 10 00 07 00 04 06 00 00 01 00
10: 00 00 00 00 00 00 00 00 00 02 07 00 20 30 00 00
20: 00 92 10 93 00 91 f0 91 00 00 00 00 00 00 00 00
30: 00 00 00 00 40 00 00 00 00 00 00 00 0b 02 00 00

Slot:	00:1d.0
Class:	USB Controller [0c03]
Vendor:	Intel Corporation [8086]
Device:	System Controller Hub (SCH Poulsbo) USB UHCI #1 [8114]
SVendor:	Intel Corporation [8086]
SDevice:	Device [8119]
Rev:	07
00: 86 80 14 81 05 00 00 00 07 00 03 0c 00 00 80 00
10: 00 00 00 00 00 00 00 00 00 00 00 00 00 00 00 00
20: 41 50 00 00 00 00 00 00 00 00 00 00 86 80 19 81
30: 00 00 00 00 00 00 00 00 00 00 00 00 ff 01 00 00

Slot:	00:1d.1
Class:	USB Controller [0c03]
Vendor:	Intel Corporation [8086]
Device:	System Controller Hub (SCH Poulsbo) USB UHCI #2 [8115]
SVendor:	Intel Corporation [8086]
SDevice:	Device [8119]
Rev:	07
00: 86 80 15 81 05 00 00 00 07 00 03 0c 00 00 00 00
10: 00 00 00 00 00 00 00 00 00 00 00 00 00 00 00 00
20: 21 50 00 00 00 00 00 00 00 00 00 00 86 80 19 81
30: 00 00 00 00 00 00 00 00 00 00 00 00 ff 02 00 00

Slot:	00:1d.2
Class:	USB Controller [0c03]
Vendor:	Intel Corporation [8086]
Device:	System Controller Hub (SCH Poulsbo) USB UHCI #3 [8116]
SVendor:	Intel Corporation [8086]
SDevice:	Device [8119]
Rev:	07
00: 86 80 16 81 05 00 00 00 07 00 03 0c 00 00 00 00
10: 00 00 00 00 00 00 00 00 00 00 00 00 00 00 00 00
20: 01 50 00 00 00 00 00 00 00 00 00 00 86 80 19 81
30: 00 00 00 00 00 00 00 00 00 00 00 00 ff 03 00 00

Slot:	00:1d.7
Class:	USB Controller [0c03]
Vendor:	Intel Corporation [8086]
Device:	System Controller Hub (SCH Poulsbo) USB EHCI #1 [8117]
SVendor:	Intel Corporation [8086]
SDevice:	Device [8119]
Rev:	07
ProgIf:	20
00: 86 80 17 81 06 00 10 00 07 20 03 0c 00 00 00 00
10: 00 40 2c 94 00 00 00 00 00 00 00 00 00 00 00 00
20: 00 00 00 00 00 00 00 00 00 00 00 00 86 80 19 81
30: 00 00 00 00 50 00 00 00 00 00 00 00 ff 04 00 00

Slot:	00:1e.0
Class:	SD Host controller [0805]
Vendor:	Intel Corporation [8086]
Device:	System Controller Hub (SCH Poulsbo) SDIO Controller #1 [811c]
SVendor:	Intel Corporation [8086]
SDevice:	Device [8119]
Rev:	07
ProgIf:	01
00: 86 80 1c 81 06 00 00 00 07 01 05 08 00 00 80 00
10: 00 46 2c 94 00 00 00 00 00 00 00 00 00 00 00 00
20: 00 00 00 00 00 00 00 00 00 00 00 00 86 80 19 81
30: 00 00 00 00 00 00 00 00 00 00 00 00 0b 01 00 00

Slot:	00:1e.1
Class:	SD Host controller [0805]
Vendor:	Intel Corporation [8086]
Device:	System Controller Hub (SCH Poulsbo) SDIO Controller #2 [811d]
SVendor:	Intel Corporation [8086]
SDevice:	Device [8119]
Rev:	07
ProgIf:	01
00: 86 80 1d 81 06 00 00 00 07 01 05 08 00 00 00 00
10: 00 45 2c 94 00 00 00 00 00 00 00 00 00 00 00 00
20: 00 00 00 00 00 00 00 00 00 00 00 00 86 80 19 81
30: 00 00 00 00 00 00 00 00 00 00 00 00 0b 02 00 00

Slot:	00:1e.2
Class:	SD Host controller [0805]
Vendor:	Intel Corporation [8086]
Device:	System Controller Hub (SCH Poulsbo) SDIO Controller #3 [811e]
SVendor:	Intel Corporation [8086]
SDevice:	Device [8119]
Rev:	07
ProgIf:	01
00: 86 80 1e 81 06 00 00 00 07 01 05 08 00 00 00 00
10: 00 44 2c 94 00 00 00 00 00 00 00 00 00 00 00 00
20: 00 00 00 00 00 00 00 00 00 00 00 00 86 80 19 81
30: 00 00 00 00 00 00 00 00 00 00 00 00 0b 03 00 00

Slot:	00:1f.0
Class:	ISA bridge [0601]
Vendor:	Intel Corporation [8086]
Device:	System Controller Hub (SCH Poulsbo) LPC Bridge [8119]
SVendor:	Intel Corporation [8086]
SDevice:	System Controller Hub (SCH Poulsbo) LPC Bridge [8119]
Rev:	07
00: 86 80 19 81 03 00 00 00 07 00 01 06 00 00 80 00
10: 00 00 00 00 00 00 00 00 00 00 00 00 00 00 00 00
20: 00 00 00 00 00 00 00 00 00 00 00 00 86 80 19 81
30: 00 00 00 00 00 00 00 00 00 00 00 00 00 00 00 00

Slot:	00:1f.1
Class:	IDE interface [0101]
Vendor:	Intel Corporation [8086]
Device:	System Controller Hub (SCH Poulsbo) IDE Controller [811a]
SVendor:	Intel Corporation [8086]
SDevice:	Device [8119]
Rev:	07
ProgIf:	80
00: 86 80 1a 81 05 00 00 00 07 80 01 01 00 00 00 00
10: 00 00 00 00 00 00 00 00 00 00 00 00 00 00 00 00
20: 61 50 00 00 00 00 00 00 00 00 00 00 86 80 19 81
30: 00 00 00 00 00 00 00 00 00 00 00 00 00 00 00 00

Slot:	02:00.0
Class:	PCI bridge [0604]
Vendor:	PLX Technology, Inc. [10b5]
Device:	PEX 8505 5-lane, 5-port PCI Express Switch [8505]
Rev:	aa
00: b5 10 05 85 07 00 10 00 aa 00 04 06 00 00 01 00
10: 00 00 10 92 00 00 00 00 02 03 07 00 21 21 00 00
20: 00 92 00 92 01 91 51 91 00 00 00 00 00 00 00 00
30: 00 00 00 00 40 00 00 00 00 00 00 00 0b 01 00 00

Slot:	03:01.0
Class:	PCI bridge [0604]
Vendor:	PLX Technology, Inc. [10b5]
Device:	PEX 8505 5-lane, 5-port PCI Express Switch [8505]
Rev:	aa
00: b5 10 05 85 07 00 10 00 aa 00 04 06 00 00 01 00
10: 00 00 00 00 00 00 00 00 03 04 04 00 21 21 00 00
20: 00 92 00 92 01 91 11 91 00 00 00 00 00 00 00 00
30: 00 00 00 00 40 00 00 00 00 00 00 00 0b 01 00 00

Slot:	03:02.0
Class:	PCI bridge [0604]
Vendor:	PLX Technology, Inc. [10b5]
Device:	PEX 8505 5-lane, 5-port PCI Express Switch [8505]
Rev:	aa
00: b5 10 05 85 06 00 10 00 aa 00 04 06 00 00 01 00
10: 00 00 00 00 00 00 00 00 03 05 05 00 f1 01 00 00
20: f0 ff 00 00 21 91 31 91 00 00 00 00 00 00 00 00
30: 00 00 00 00 40 00 00 00 00 00 00 00 0b 01 00 00

Slot:	03:03.0
Class:	PCI bridge [0604]
Vendor:	PLX Technology, Inc. [10b5]
Device:	PEX 8505 5-lane, 5-port PCI Express Switch [8505]
Rev:	aa
00: b5 10 05 85 06 00 10 00 aa 00 04 06 00 00 01 00
10: 00 00 00 00 00 00 00 00 03 06 06 00 f1 01 00 00
20: f0 ff 00 00 41 91 51 91 00 00 00 00 00 00 00 00
30: 00 00 00 00 40 00 00 00 00 00 00 00 0b 01 00 00

Slot:	03:04.0
Class:	PCI bridge [0604]
Vendor:	PLX Technology, Inc. [10b5]
Device:	PEX 8505 5-lane, 5-port PCI Express Switch [8505]
Rev:	aa
00: b5 10 05 85 04 00 10 00 aa 00 04 06 00 00 01 00
10: 00 00 00 00 00 00 00 00 03 07 07 00 f1 01 00 00
20: f0 ff 00 00 f1 ff 01 00 00 00 00 00 00 00 00 00
30: 00 00 00 00 40 00 00 00 00 00 00 00 0b 01 00 00

Slot:	04:00.0
Class:	Ethernet controller [0200]
Vendor:	Intel Corporation [8086]
Device:	82572EI Gigabit Ethernet Controller (Copper) [10b9]
SVendor:	Intel Corporation [8086]
SDevice:	PRO/1000 PT Desktop Adapter [1083]
Rev:	06
00: 86 80 b9 10 07 04 10 00 06 00 00 02 10 00 00 00
10: 00 00 02 92 00 00 00 92 01 20 00 00 00 00 00 00
20: 00 00 00 00 00 00 00 00 00 00 00 00 86 80 83 10
30: 00 00 fe ff c8 00 00 00 00 00 00 00 0b 01 00 00

